1750,Great Auto Service!  Andy gets what needs to be done and you feel your in good hands and paying a fair price.  He is a great mechanic... we have been using...
1752,"I spotted a recommendation for Bud's on Phillyblog as a good mechanic for older, classic vehicles. My old reliable neighborhood shop on 40th and Powelton..."
1752,Been going to Buds for a long time now and have always felt I was treated fairly.  The costs have always been reasonable.  Its hard to find a mechanic you...
1753,"PLEASE NOTE: the two reviews for Todd's Brake Shop were written by MEN (Keith M. 6/29/12 and Michael L. 6/15/10).

I am a WOMAN.

I wanted to like Todd's..."
1753,Getting my oil changed.  Todd is the best mechanic in DelCo!!  Been using them for 15 years!!
1753,"Professional, friendly and honest car service.  Todd and his team are as good as it gets!"
1761,"Absolutely the best, most honest and trustworthy mechanic I ever went to.  I have recommended Garret to many people.   I bring my three personal cars and my..."
1761,"Tim took the time to help me out and look at my car. He concluded that I really didn't have an issue, just possibly the random place I went to get an oil..."
1761,"Honest, friendly, and fast--three qualities every car repair shop should have.  I brought my car in while it was making horrible loud noises under the hood...."
1761,I have never written a negative Yelp review but I feel I MUST do so now. Forced to give a star but none are deserved! This business is a complete and total...
1761,I highly recommend Garrett Car Care.  I have been using them for years and trust them 100%.  I drop off the car and just tell them to do whatever needs to...
1761,Here's my experience with Garrett car care. I came here on the recommendation of somebody and was told the mechanic is nice guy(which he was) and that he...
1762,"Had a shake and odd noise I couldn't quickly identify while in Garrett County for a ski trip. These guys were great. The got me in, identified the problem..."
1762,Garrett Automotive has been looking after my 1983 Lincoln Continental for the last five years enabling me to safely get to and from the car shows I attend...
1762,My nephew came to Deep Creek Camp Grounds pulling his camper from Passadena MD.He arrived late Thursday evening and while trying to park his camper on the...
1767,"Just had another great experience with Fox Run and tires.  Our family has 4 cars ranging from 2006 to 2019 and we ONLY use Fox Run to service them.  Yes,..."
1767,"This company did me wrong. He towed my car about 9:15 to the dealership. Evidently, he dropped my car on the wrong side of the service dept. The driver..."
1767,"If you are looking for a honest, quality, ""good ol"" garage this is the place. I my timing belt snapped on Route 1 and luckily got towed to Fox Run Auto...."
1781,"This Walmart is on the newer side and its a super center so its big! It's got everything from food, to clothes, to tires, to tools, to cd's to basketballs!..."
1781,Trucking dwn the highway ... parking was available decided to stop and shop ! Bathrooms clean but not much i can say a walmart is a walmart
1781,"I am sitting in my car in the parking lot still. I never judge Walmart, because the bar is already so low anyway. I am struggling with money right now (just..."
1782,Rude and incompetent service. Came in to get my iphone 11 (that was purchased through Verizon) activated. Person stated they don't do that and I had to call...
1782,Young man with bad attitude. Went in for help with my phone. Kept saying I have no idea what you've done to your phone. Clearly not helpful to older...
1782,"Came in to ask a question about my cell service. Discovered this is a franchise, this always concerns me. We were helped by Ally, she was fantastic...."
1785,"If I could make this store a MINUS 5 I would
HORRIBLE CUSTOMER SERVICE... RUDE MANAGEMENT..
BUYER BEWARE!! 

I've spent 1000's of dollars in this store but..."
1785,"Van's SCREWED me over, they said they could not compensate for a price difference that I found on line for flooring  Coretec product I found on..."
1785,I will not use Van's to install anything in my home again.  The installers who showed up to install my bathroom vinyl floor were unprofessional and did poor...
1787,"I placed a grocery pick up order about 30 hours in advance. When the time came to be notified that the order was ready, nothing. It took almost an hour for..."
1787,The Tire Center is an absolute joke!  Open at 7??  Why is the door still locked and nobody around at 7:20?  After walking all the way around the building...
1787,Literally at least 10 different employees have passed by and looked at me at the customer service desk. Not one said anything to me. And the manager with an...
1795,"2 big main rooms - weights in one and treadmills, ellipticals, bikes, etc. in the other. Group workout room in back. Also a room with projector to follow..."
1796,This is the best gym I've ever belonged to! There is a wide variety of weights and cardio equipment but what really makes this place special are the people...
1800,"I love this gym! I knew nothing about weights and the owner, Mike has been incredibly helpful. Friendly staff and patrons, great equipment and I love the..."
1800,This has been the best gym I have ever been a part of. One of my biggest disappointment of moving from Fort Wayne was leaving the gym. It is on the smaller...
1800,"This is in response to Danielle C's review. They are the same owners of my Anytime Fitness where I live and they quit offering the ""included"" classes mid..."
1802,Haven't been here in years! Forgot how big this fieldhouse was! I'm an AAU mom now so it looks like we will be here a lot now!
1802,"Good gym, but I had to knock off one star due to fact this place is crawling with jerks by the sack loads bouncing them basketballs loudly and rudely while..."
1802,Super cool gym. Tons and tons of machines. I believe there were two of not more baseball courts. There was an upstairs track for running and a separate room...
1803,You can workout and nobody will bother you. Or you can be chatty. All people are treated with respect and kindness at this place. The owner (stopped working...
1804,"Clean, friendly, well-equipped gym at a reasonable price. Come and go as you please at all hours of the night and day. Two thumbs up."
1804,Depends on what you need for a gym. I did a day pass and the equipment was in good working order and clean. It's a small facility but you can definitely get...
1806,"This is one of the few gyms in Columbia City and the only that I know of that is open 24/7, hence the name anytime fitness. 

They have a huge parking lot..."
1806,"The manager has the PR awareness of a sea urchin. In a discussion about a membership policy that lasted no more than 4 minutes, she became angered easily..."
1811,"Let me start by saying that I am a huge fan of mom-and-pop escape rooms.  They have to try so much harder than a franchise in the sense of rooms, clues,..."
1811,We had a awesome time !! Our Grandson LOVED it at the age of 8 !!! We will definitely be back !! Thank you Great Escap
1811,Great time tonight playing tonight with family and friends!  The Killer's Lair was fun and the puzzles were awesome!  I want to try the other rooms too!
1815,My fiancé and I had an appointment scheduled with Kellee for a tour this morning at 10 AM. It took us just over an hour to get to Rockfield Manor. When we...
1815,"I just got married here on Saturday and let me tell you - Rockfield Manor is AMAZING. The venue is stunning, but the staff is even better. Kellee, the..."
1815,"Let's get this party started right. .Wine party that is. Where there is wine. That's where you can find me. 
I was here for the 10th annual Harford county..."
1818,I work with Veterans in Adaptive Sports and I called this bowling alley to ensure that it was Wheelchair accessible.  I informed her that I would have three...
1818,Grew up here. I bowled here every Saturday. Great place for family fun or for leagues. Deff sign your child up for leagues it's so fun and mr Bobby is awesome
1825,"This is a pretty awesome indoor playroom destination. Probably best for kids from 6 months to 5 years. There's a variety of activities - ball pit, jungle..."
1825,My 4 year old loves the playroom. It's geared towards 5 and under although older kids are welcome. The only down fall I would say is it is 10$ for child a...
1825,What a wonderful space.  There is so much to do here you could really spend hours just playing.  We are doing one of the story time classes as well and the...
1828,"A gem hidden in Fallston, why we have not been here sooner is beyond me. 
We came in around 530pm and sat in the bar area. Our server, Emma, quickly came..."
1828,"Enjoyed another outstanding dinner with them tonight.  The food was excellent, the portions were perfect, and the service was great! Ordering on line was..."
1828,Returned to Fallston Barrel House just for the opportunity to have their Barrel House Shrimp appetizer! All of the food is great but the shrimp is exceptional.
1831,"Awesome state park. 

Like most awesome things, there is just not enough of this park to go around. I saw at least two picnic areas but by the time I was..."
1831,"[Coronavirus review]
Maryland is a diverse state, and frankly this is the least interesting region of it, lacking the grace and and beauty of shale infused..."
1831,"This review is specifically for the King and Queen Seat Loop (white trail). Came at 10am on a Sat AM in Feb (30 deg, windy). Had no trouble parking at what..."
1835,i went Here with my dad and fed the ducks. They really liked the frozen peas I gave them.   The duck came out of the pond and opened his wings and I was scared.
1835,"I went to this park because it looked adorable every time I drive by. The ducks aren't scared, which is interesting. But the park itself was trashy. It..."
1837,"A pleasant park for loading boats, jet skis, jogging, birdwatching and more in Edgewood in Harford County Maryland. Photography is one of my hobbies and..."
1837,Mariner Point Park used to be great and now the scum of humanity hang out at this park and they are nasty nasty people that race through the park in their...
1837,"Smaller than most parks, but worth the visit. Has a great trail with some spectacular views. Packed with gazebos, designated picnic areas and picnic tables...."
1853,"Great dinner here. Crab cake was great, very good steak for a fish restaurant. The fresh bread was delicious. Cocktails were not up to 'craft cocktail'..."
1853,"So, let me start by saying yesterday I would have given this restaurant a 6 out of 5. We have probably been here 5 times in the past 2 weeks. The food has..."
1853,We found our new favorite place! Went in at 3:00 on a Saturday and had no trouble getting seats at the bar and Madison served us right away. Her service was...
1854,"An EXCEPTIONAL carry-out experience during these modified times.  Friendly customer service, prompt preparation time, and delicious product.  Seafood & meat..."
1854,Their food is amazing. We got it during the pandemic which brighten up our day to get such amazing food while at home. The service was great and the women...
1854,They have opened up during this Coronavirus crisis to take out... does not matter if its eat in or take out... outstanding food. Take the time to support...
1856,"Just had dinner at Giovanni's and it was a nice dining experience. From the greeting at the door to the friendly waitress, I enjoyed my time spent there...."
1856,"I can't say enough good things about our dinner this evening.  My husband has 6 major food allergies (gluten, soy, dairy, sugar, grain and nightshade) so..."
1856,"A hidden treasure. Food is great drinks are always cold. The night we went we enjoyed calamari, steamed mussels, chicken marsala, and the special veal chop...."
1859,Always spectacular food and service. Went for a late Valentine's Day dinner last week and everything was AMAZING. The Brie was lovely and had the best...
1859,"We happened to come here on a Wednesday evening when they had a 3-course $42 dinner. My sister had been here several other times and loved it.

My opinion:..."
1859,"5!

Stumbled onto this place for brunch actually trying to go to a neighboring restaurant which had its detour sign up. 

Wow, excellent service and food..."
1860,My favorite sushi in Bel Air. Very fresh fish. A little pricey for the size but worth it in quality to me.
1860,I've been in HC for years and years and have never tried Fuji Sushi. I wanted something different than the sushi spot that's closer to me (that I'm not a...
1860,"I have been here several times and just noticed I never rated it. So, the service is always good. And surprisingly my favorite dish is the Curry Pancake..."
1861,We are not into chains but this place is good. The bang bang shrimp is are go to along with the dumplings. Cocktails are always good and so is the beer...
1861,"We have been to this location many, many times. 
But not in the past 4-6 months. 
Learned my lesson- Yelp everything!! 

We have never had anything but good..."
1861,Came here on a very busy Saturday around 5pm. You definitely need to make reservations. We ate in the bar area where it's a little brighter and the tables...
1862,One of our favorite local restaurants!  The service is always amazing and one of the best margaritas I have ever had.   The server Tony is our favorite when...
1862,Love La Tolteca! Authentic Mexican food in a fun atmosphere. Definitely start with the chips and dips. Everything is delicious! Try the margarita!
1862,"Came by at dinner time on a Sunday night. Very busy, no line. Got a table for two right away. I love the complimentary chips and salsa; the white sauce is..."
1863,"Try the crab ravioli, it is amazing!! Pizzas are great!! Honestly you can't go wrong with anything on the menu."
1863,We came here on New Year's eve and this place was packed. Like almost every table was full. Even a reserved table that was cancelled was spoken for...
1863,Fast delivery! Eggplant chips were amazing!! Pizza was soooooo salty and margherita pizza did not look or taste like any of the same type that I have ever...
1864,"Located in the Festival shopping center, you can't beat their lunch buffet.

The buffet always has Samosas & Pakoras as starters.  Tandoori Chicken, various..."
1864,"Wonderful, flavorful recipes and some of the kindest staff around.  I highly recommend their hummus and naan.  Actually, we have gotten a variety of menu..."
1864,"Tonight was the second time I've ordered carry out from Indian Garden. I love that they have so many vegan options. The entrees are huge, easily three..."
1865,The food and carry out service have been amazing during the recent restaurant shutdowns.  We have gotten carry out multiple times and they are always spot on!
1865,"The atmosphere is awesome, especially the patio. The staff has always been great too. Their food is ok-not bad but not great either. The rockfish bites are..."
1865,You ready for a good time and god food well come on in! I have frequented this place due to some boss lunches and it has always been pleasant! The...
1866,"(from August 2019) My husband, 9 month daughter and I enjoyed an outdoor breakfast at Sunshine. We thought we'd have to wait awhile because they appeared so..."
1866,"This is definitely one of my favorite restaurants in the area. It's super cramped inside, and there's always a line. It is definitely worth the wait..."
1866,"Best breakfast and service!  It's obvious many people agree, as this place was packed on our visit.  The decor is friendly, warm-cute.  The staff are..."
1870,"Very unprofessional , inhumane hospital full with lazy and shady staff. 
Dangerous for your loved ones, even if pregnant no care for patients, my wife told..."
1870,This place is dirty and disgusting. It's hard to believe people come here to seek help.
1870,"Horrible ER procedures, slow, and belligerent staff.  There is no semblance of order."
1871,I have been seen at Upper Chesapeake Hospital ER 2 times for severe migraines. I was always treated with upmost respect and cared for with kindness and...
1871,"This hospital needs to be shut down. One of the worst places to ever have visited. 

Visited here with my wife. The staff are rude, inattentive, and without..."
1871,Terrible experience.  Got signed in and xrays within 45 minutes.  Spent the next 3 hrs an 15 minutes waiting.   I have a knee injury 66 years old.  No place...
1900,"Very unprofessional , inhumane hospital full with lazy and shady staff. 
Dangerous for your loved ones, even if pregnant no care for patients, my wife told..."
1900,This place is dirty and disgusting. It's hard to believe people come here to seek help.
1900,"Horrible ER procedures, slow, and belligerent staff.  There is no semblance of order."
1905,If I could give zero stars that is what it would be.  I had a surgery scheduled for 1-9-18.  Before the surgery they verified my insurance and gave me a the...
1905,"My experience was quite negative , the first visit they tried to steal a deductible that my insurance company said I already meet . Which I did all the..."
1913,Took my scion Tc to Gary and now my Mustang Gt and he did some exhaust work for me.  I took it back for a slight rattle and he tightened everything up for...
1917,"Don't recommend. There are cheaper & better service stations anywhere else.
For example, brake job here $769, same job at Sears Auto $539....but that's also..."
1917,Good experience at a family-owned shop that does real repair work.  Service manager was a professional and the shop was busy and organized.
1917,I have had my car worked on twice at Holzhauser's & both times have been excellent experiences.  If I trust my baby with them I have to recommend them highly.
1918,"I am so happy that I found Buddy's Auto after moving to the Abingdon area. These guys are top notch all around, both from the work they do to the care they..."
1918,"I went to Buddy's for brakes and to get a tune up.  First time there.  They did the brake job, but called to say that my car wasn't in need of a tune up..."
1918,My AC stopped working on 95N with my long haired dog in the car on a 90 degree day. I knew I wouldn't make it another 2 hours to NJ so I go off the highway...
1919,First time to this business and will certainly return for more business. I purchased a new set of luxury tires 4 weeks ago from another business. Upon...
1919,John and Ben are amazing! They really help our Veloster community to the best of their abilities. They have even stayed passed work hours to help when my...
1919,"Took my truck there and asked to have the transmission looked at, there was a leak. I should have stopped when they said they wanted to do a flush but I let..."
1920,"Good, honest mechanics are hard to find, and these guys are at the top of both lists! We've been taking our cars to them for 7 years, and have never had an..."
1920,"After finding Next Gen close to 4 years ago we wont take our car's anywhere else!!  They're trustworthy, honest, fair, friendly, but more importantly they..."
1920,"Fantastic service. Excellent work, fair prices. I have taken all of my vehicles to Next Generation Mechanic for more than 6 years. A.D. and  Beth are always..."
1921,"I stumbled upon API Auto Service when my car broke down while on travel for work. Without any local preference options, I fortunately wound up at API after..."
1921,"New to the area and needed a general fluid over haul, belts, rotors and breaks. These guys did such an amazing job! Customer service was wonderful, very..."
1921,This is the only car care provider I trust with my beloved 1987 Mercedes. After trying several other  providers in the area I'm very happy to have found...
1927,"Best auto repair shop I've seen in the multiple states I lived.  Bob was fair, honest, and respectful of my concerns on my '08 Rubicon."
1927,Hands down the best auto shop in Maryland and beyond. Bob and Steve are both absolutely awesome people. Always full disclosure on pricing and repair needs....
1931,"I give them three stars because it was a quiet, clean place with great sales. However, the fact that the restroom area is not equal to both genders..."
1931,"When I'm in Harford County, this Macy's is my go-to. It's relatively small--only one floor, but it has everything I need in a department store. There is..."
1931,"Placed an order online.  I lost my email confirming my order was in so I called to verify with the ""At Your Service"" line.  Operator was rude and didn't..."
1933,Customer service sucks. Absolutely terrible. Feeds all types of misinformation. Does not help customers at all. Only thing they care about is sales....
1933,Terrible service. I waited unnecessarily long while the employees sat around and didn't help a single customer in the store. All employees were dressed...
1933,"Horrible rude service, untrained uncaring staff
Given wrong prices, with 3 visits got three totally different sets contradicting information. 
No desire by..."
1934,"20 minutes to shop, 25 minutes to check out, second in line. Average ring and bad rate of 23 seconds per item.....yes, I have that kind of time standing..."
1934,"I am so tired of going into this store for items and they are never stocked. Asking any worker in the area if they have any in the back, is always answered..."
1934,"I've always liked this wal mart. Read all the bad reviews and I'm surprised. There have been a few times they haven't had everything we went for, but they..."
1934,Says 24/7 but clearly isn't.... had emergency with a coffee pot breaking and leaking right out of the box. Attempted to call to figure out the return or...
1934,This store is pretty much just your average Walmart. I don't shop at Walmart to often anymore because there is so much clutter in some isles and others have...
1936,"I would give negative 5000000 stars. 
I don't know what girl it was that I spoke to but I called this store right after I got off the phone with Verizon..."
1936,We recently moved to MD and I had some questions about FIOS. As soon as we walked in I felt as if I was a bother rather than a customer. I have never been...
1936,"Super friendly folks here, haha not even close!  There are plenty of these little shops around, stay away from this place if you want good service. I came..."
1938,"This Penney's is clean and well organized, and the parking lot is huge. It's never crowded when I've been, although it can sometimes be difficult to find an..."
1938,"I am going to go with 1 star. I was originally trying to decide between 1 or 5 stars. I went to JC Penny on Labor Day Weekend (a Sunday morning, to be..."
1938,The manager Rachel is very rude. The site to store department is horrible. This is my third time ordering site to store and the first time I never received...
1943,"Tried to place an order online.  It wouldn't take my billing address.  Had to enter it in three different ways, then finally.  I even called to make sure..."
1943,You know I don't get what the big deal is if I return something  I bought a pair shoes at the underground journeys in the same mall and I was told if I...
1943,"Went there 04/04/15, was the first customer there lol. Damian was extremely helpful and awesome! I asked for a pair of linen and oat sperrys in a size 8,..."
1948,"Need a place to shop for chain store clothing, well this may satisfy some of those needs but more than likely not all. If I had to take a guess I believe..."
1948,3 stars doesn't surprise me. It's not even a mall. It doesn't even have food court. It should just be called Hartford Shopping Center or something like that.
1948,So funny thing is that this mall don't have much. There is not a big crowd or anything. From reading the reviews everyone feels that this place is boring....
1949,"It's sad cause of how much I loved Ross!!

The people here make it worse and worse for you to want to be a customer!

I usually spend a minimum of $ 100.00..."
1949,"Customer service is absolutely horrible. I always find cute items here, but the service just makes me not want to come back. I asked an employee a question,..."
1949,"What in the world??? TWO cashiers? On a Saturday afternoon! Really? Not only is this place a mess, under-stocked and disorganized, but the poor cashiers..."
1950,Location staff and management do not really seem concerned with providing good customer service to customers. I went into the Retro Fitness located at 802...
1950,So I will say first and foremost this place can get slamming packed depending on when you go like early morning or around dinner time. If you go around 1.5...
1950,"I switched from planet fitness just to change up my routine and they have free weights vs smith machines which is nice. Also, staff is pretty chill. Not..."
1952,"I came here on occasion if the other anytime fitness is crowded or I'm in the area after work. Just like the othe two places, definitely could be a little..."
1952,"Just use another gym. Avoid it. When I first signed up the agreed monthly cost and sign up fee was set, and then when they asked for my card they told me..."
1952,I love this place! I've been to two other gyms in the area and this is the first place that I feel the staff truly cares about their members' health and...
1953,"Have been here since they opened about 10 years ago. This gym went down hill fast. Over crowded, dirty weights and old equipment. The layout is horrible..."
