2934,Arrived at ER after driving myself  while undergoing arm neck jaw shoulder and left shoulder blade pain/discomfort.  Taken in immediately for EKG...Results...
2934,"My elderly father who has dementia, was brought into the er.He was treated with respect and dignity.He was seen promptly as this was not a life threatening..."
2935,"I had a c-section scheduled at st lukes Anderson Campus on 21st. I had an very good experience there, from Dr Taverna Miller and her  crew down to the..."
2935,Unfortunately we've been here a few times over the past month.  Fortunately St. Luke's is a top notch network And Anderson is a a wonderful facility....
2935,A dedicated team of hospital workers that is set to expand as they build a dozen or more buildings here over the next few years.
2937,"St Mary's Hospital . Not somewhere I'm just dying to go , but if  you're in need of some mEdical attention it's a good place to be .
I was just taking my..."
2937,"Buyers BEWARE! This hospital is known for unethical billing practices. You will be charged for services far higher than market average. 

We recently had an..."
2937,I went to visit a friend here that works here as a nurse. One of the staff members confused me for someone else. But I told her why I was there. Shoutout to...
2976,"My car was at a different garage for over 2 months and I finally brought it to Mike and his crew.  There was major work that needed done, including a new..."
2981,Just passing through but the store was what I expected with lots of parking. I just needed some supplies and being most store are set up the same I knew...
2981,"Like most people, I have a love/hate relationship with WalMart. I like low prices, I hate the shambling masses who shop there. The store recently rearranged..."
2981,Just passing through St Mary's. This is one of Cleanest neatest zeal Marts we have stopped at.  Community lucky
2989,This shop is adorable. They offer so many gifts and decor.  They absolutely are a must visit.  The decor is priced affordable and the pieces are unique.
2989,It saddens me greatly to write this.  I was looking forward to keeping business local and not take it to someplace like Walmart.  But they were the one's...
2995,Don't believe these reviews sears has all the negative reviews deleted!!! Shady people running sears!!
2995,I bought a lawnmower and some tools from here and I am pretty pleased with this little Sears. While you won't find everything you would find in a big mall...
2996,I've never had any problems at this particular location. We order quite a bit of clothing through Penny's online system and then if there are issues we can...
2996,I ordered a coat and had it shipped to this store for my mother. The JCPenney in my area was out of her size so I figured it would be easier just to sent it...
2996,If I could I would give them ZERO STARS. I went to purchase items for my granddaughter that had a BOGO sign on it. Greg the manager on duty said that topper...
3009,"I live near Pelham bay in New York, so I only go there for the indoor swimming pool and the gym. I mostly go for the swimming pool mainly, only used the gym..."
3009,"***REVIEW FOR POOL ONLY***

Oops, I almost gave this aquatic facility three stars, then realized that it's not the pool's fault that I do not live way up in..."
3026,"Great playground with assisted swings, a tire swing, little buildings for imagination play,  various slides, multiple levels, and plenty of shaded seating..."
3026,"You know a place is good when one of the many times you mutter to yourself ""this place is ah-mazing"" a stranger responds with, ""I know, I can't believe how..."
3042,My husband and I had the pleasure of dining here twice during our 1st visit to St. Michaels. The first time we opted to share the house special for the day:...
3042,Wasn't very impressed with the size of the meals. We ordered a couple different meals and the portion sizes were pretty small. I ordered a breakfast burrito...
3042,"I read all of the comments, but my husband and I live in the area had an open mind in trying The Galley. A Sunday in winter-around 9:45 a.m. Rachel, our..."
3045,"Stopped on a whim with my husband , it is now on my awesome list!!!! The food and atmosphere is amazing."
3045,"This quaint local hotspot is everything I've heard it is, and more.  During our visit to St. Michael's Island, we visited Ginas twice. Although the..."
3045,"Love this place. They have a great outdoor seating area (dog friendly) with cornhole and fire pits. Indoor is tiny, which wasn't a problem for us visiting..."
3046,"Awful Arthur's was definitely the opposite of awful!
The food was amazing and the service was honestly great. Only thing I would rather see is the crab dip..."
3046,"Overall, the food was fine. We got mussels, fries, and the oysters awful. Oysters were baked, but came out cold. Mussels were good but just regular butter..."
3046,"Since I know nothing of  this area, I was recommend here by my hotel - Hampton Easton and I was happy. They gave me several suggestions but one place I went..."
3047,"Good food, ice-cold beer, friendly service.

The Saloon has an inviting and friendly atmosphere true to its name. We were immediately shown to a booth with..."
3047,"My husband and I with 3 others guys visiting from Florida stopped in St Michaels on way home from Rehoboth beach before heading back home to Florida.

Well..."
3047,"Great place in town to have drinks! We went here both nights after dinner. Great, friendly staff! One amazing thing is they offer a shuttle to take you..."
3050,Enjoyed the sliders which included a crab slider and delicious North Carolina mustard bbq sauce. Service was quick and very friendly.  Blues music played in...
3050,This place is awesome!  I have never been disappointed with anything I have ordered here.  The cream of crab soup is outstanding!  Last visit I ordered the...
3050,"We stopped for lunch while exploring the town. We had a stroller and dogs, so we called ahead and got our food to go. The woman on the phone was very polite..."
3056,"My wife and I have been here a few times. 
The lasagna is good, as is the gnocchi. 
The mushroom ravioli in creamy vodka sauce is my favorite. 

There is..."
3056,"5 of us walked in for dinner. Hostess (who was nice!) said to wait a minute, and went to the back. A man came out and stared at us, we asked for a table for..."
3056,"This is the best!  Everything you would ever wish for on an Italiano restaurant. Great food, great service and ambiance. All for an extremely fair price...."
3073,"After being the middle car in an accident my car was left with damage to both ends of my car, It need a lot of work done. After a friend recommended New..."
3073,"I have come here several times over the years and have always been very satisfied with the work they do. The owners, Hector and Julio, take the time to..."
3073,"Showed up before the shop was open. They took me right away without problem! Drove with me to try to determine an issue, inspected my car, and determine the..."
3075,"We were heading home from vacation 
Tire light came on in the car.
Pulled in, and within 15 minutes they adjusted tire pressures for free! 
Great service..."
3075,This place is an absolute rip off. Went in for an alignment only to pick up my vehicle even worse. Twisted the inner tie rods so much they tors the dust...
3075,Top notch customer service! Bay 100 stepped in and saved our New Year's Eve.  With a smile and a handshake their old school customer service is a refreshing...
3078,Came in to get my exhaust tips put on my 2004 VW R32. The tips diameter were considerably larger than the pipes so I was very curious how the two would come...
3082,i would never do business with them.. do not bring your car there.. they allowed my car to get a ticket without telling me. how can you possibly allow my...
3082,I brought my 14 Q50 here after my bumper got scratched up. The gentleman at the desk took a look at it and gave me a quote of 375. 150 less than other...
3082,This place is horrific and the owner and his son are rude and unprofessional con artists. Frantz the owner and I agreed on repairs and a total cost. He...
3087,"Best PF I've ever been to! So I've been to 4 locations here in PA and this is the best in terms of cleanliness, overall layout & value. It's the only PF..."
3087,The owners of Downingtown PF KNOW that there is a ventilation problem in their tanning and Total Body Enhancement rooms yet they choose to do nothing about...
3087,I know you get what you pay for but this location is rediculous. Ive been a member at 2 other locations and this location by far is pretty bad. They just...
3091,This place is awesome! A great place to work on your climbing skills with all the bouldering and top rope climbing one could want. It is clear the owners...
3092,"Great spot, good swimming pools (inside and out). Gym is up to date and fitness advisers are on site. Bounce center is not bad for the kids either. Staff is..."
3092,I would not recommend using the child care center that they offer! It's high school teenagers who are on their phone not watching children and they do not...
3092,"My wife just went to the Y in Elkton with our two daughters (2 years old and 7 months old), putting them in the day care while she worked out. 

These two..."
3096,"I used to work in Taneytown, and live 40 minutes away. I decided that I wanted to workout before or after work so I went in to anytime fitness to sign up...."
3096,"Kind of small. Equipment is in decent shape, but the gym atmosphere just isn't that great here compared to other anytime fitnesses."
3102,"Ooo what a nice change from my over crowded, over used, not well maintained, Miami gym. Hearthstone is great the moment you walk in, a beautiful space that..."
3102,My husband and I were visiting friends in St. Michaels and read the reviews on Yelp and have this gym a shot. They moves in April 2018 so the facility is...
3102,"My husband and I got a week pass while we were staying with family in Easton during the holidays. The week pass was $55/person, which is not bad if you plan..."
3108,"We hired Washington Talent Agency to provide ""DJ Chaos"" for our daughter's Bat Mitzvah this past Saturday night at Guapo's in DC, and we could not have been..."
3108,"There are no words for how upset I am with this company.  I wrote to inform them that due to Covid-19, our wedding scheduled for this June has been..."
3108,We have been continuously impressed with Washington Talent Agency since booking Encore over a year ago. When we were still deciding which band to perform at...
3111,Highest quality dance instruction in the area. You don't find a school like this often! The instructors have been here for years and truly care about the...
3111,Love Berks Ballet Theater! They offer the finest training in ballet. Teachers care deeply about the art of ballet and it's obvious that sharing their gifts...
3111,"If I could give them a zero I would. The teachers do not care about the kids, all they seem to care about is money. There is no encouragement for the kids,..."
3115,"You know it's not really a 'mall', right? Concerning this mall isn't for shopping, it's my kind of mall though. So why is it called a 'mall'? I wondered..."
3115,"It's a fantastic place to spend a few hours.

The reflective pool wasn't very full that day. Lincoln Memorial is tranquil and peaceful. 

The national World..."
3115,"If you didn't visit the National Mall, were you even really in Washington D.C.?  Haha.  Jokes aside, the National Mall is truly a must visit while in DC!

I..."
3118,"It was family oriented and very well organized. My family and I had a great time! Puerto Rico lost but they are champions in our hearts always. My man , our..."
3118,New area that is nice enough but has limited food options and is in a pretty sketchy area of town. The arena isn't too large so all the seats are close to...
3118,"This arena is so recent (2019) that it still has that new car smell. Check the web site for events. You can also rent the venue. 

Parking is a challenge...."
3119,"Just before the quarantine, the Anthem hosted the Overwatch League eSports event. It was amazing. The security, the hand washing and multiple sanitizing..."
3119,"Having been to the The Anthem several times for concerts and private events, my appreciation for this venue continues to grow! The Anthem provides a classy..."
3119,I've been here a couple times for an esports event and all times I had a great experience! The venue is at a great location at the District Wharf with a...
3120,"Having attended the Capital One Arena for various basketball games, and one concert, I have always been impressed with the experience. A good court with..."
3120,A few friends and I went here for a a comedy show. I live in the dmv area but I can honestly say I've only been to this venue twice although it is the place...
3120,"Been here many times for the Caps, concerts, UFC, and even heard the Dalai Lama speak here once. 

This place should be called Operation C+ because nothing..."
3121,"They did a great job on this park. The food and beverage sphere for ballparks continues to just get better. 

I am partial to Camden Yards, but this stadium..."
3121,"Great night to watch the final game of the playoff series!  Even better when the Nats won!

Parking in and around the ballpark can be tricky.  Suggest..."
3121,"Came for a game on a random Wednesday in September. 
First time. 

There are so many subtle nuisances to ball parks that you can't know until you go...."
3132,"With (some) state parks & trails opening back up, we've been coming to Dash Point State Park on sunny days. It's right down the road from our house which..."
3132,Coming here in the winter months you have to remember it is cold but what else can you expect from the PNW. Sorry I've been on the east coast the last 3...
3132,"This a nice trail and beach combination tucked away in Federal Way!

Once you're done walking the trail, it is nice to relax on the waters. The beach itself..."
3138,Wonderful mountain terrain with family friendly paths.  The hike down to the river is simply amazing.  After a little walk there is a large picnic are with...
3148,Excellent pizza with lots of cheese. Lives up to its name King of Cheesy. Chicken bacon ranch and Italian Stromboli are tied as family favorites.
3148,"We ordered two pizza's . I opened one and the cheese was every where but on the pizza. It was the worst pizza I ever had, Lousy...."
3148,Pizza was very good. Steomboli hardly had any chicken in it. Wings were ok. Had it delivered. Was delivered quickly and food was still hot. If your going...
3150,Cash only. This place is Amazing!! Everything smells and tastes great! You have to try the tamales--they must have a grandma in back because these taste...
3150,"Our ""go to"" Mexican in Bethlehem was closed, stopped here on our way out of state. What a pleasant surprise. SO MUCH FLAVOR and authenticity. 

A little too..."
3150,Wow.  Food is authentic and delicious.   Served on paper plates. Get the guacamole we sampled just about everything and it's soooo soooo good.   Come n get...
3152,"Great place...has items off the menu.
Like . sweet potato fries...turkey bacon  etc..
Can't beat the service...Sherry rocks it!"
3152,"Good breakfast restaurant for locals, food came out hott and tasteful. Normal prices nothing too high or low. Waitress was on the spot with service."
3152,I'm giving it a four star because for what it is it's amazing.   I've been here countless times with friends for breakfast or even breakfast for dinner the...
3153,OMG.  The Holy Grail of Mexican food tucked away in an unassuming little space.  I have serious reservations about leaving this review because I kinda don't...
3153,"We got take out from here and it was pretty good!  The recipes are good with flavorful components.  We
Got nachos, a chicken chimichanga, and a beef..."
3153,Solid Mexican cuisine and a gem off the beaten path. Very low key and worth the visit if you're in the area.
3154,"After not being able to have dinner at a nearby Indian restaurant, we decided to next nest thing was Washington diner. I ordered a cheeseburger and onion..."
3154,"Started with New England Clam chowder. Lunch specials include soup and entree and desert. 
Very tasty soup. 
Chicken Pot pie was awesome. Filled and tasty...."
3154,Used to be the place to go to for an inexpensive decent meal. Somewhere along the line they lost the flavor component. I think very little (other than...
3155,We recently had a Celebration of Life luncheon for about 16 people in one of their private rooms upstairs ( where we had 2 nice restrooms right outside the...
3155,Came here with my wife for Valentine's Day dinner (actually the day after). We had a reservation for 5pm and it didn't seem like it was needed but either...
3155,"Wow !!! This historic restaurant has fabulous ambiance , food, serving size, and service. Although we are inside I wish we ate outside on their patio as it..."
3158,"We ordered door dash from this location.  We got a cheese burger, fried fish sandwich, turkey sandwich, and chili cheese fries.  Everything was really good..."
3158,Feels like this eatery was thrown together last minute with the look of the set up. The Shop Rite products being used in plain site are also a bad optic....
3158,"AMAZING FOOD AND SERVICE! 

I'm not from this area (I live in Indiana) and was in this town for 2 weeks on Business... I can't thank one of the employees at..."
3159,"Love this place, we go here a lot and it's also great for gluten free diners. Highlights: obviously margaritas!, guacamole, shrimp skewers/tacos.

Weirdly,..."
3159,"Our family always raves about this places tacos.
This is a sister location to the one they normally
Visit but we had to stop on the way back from helping..."
3159,"Pretty solid Mexican joint. Prices are good. Food is tasty. Tequilas galore. Came for a family brunch on a Saturday.

Only downside was that service was..."
3162,Decent Mexican homestyle food available here. I grabbed chips and guacamole for an appetizer. The chips were fried freshly and were warm when served. The...
3162,I just got hung up on by the owner of this place because I got asked to substitute rice for coleslaw and I would have paid extra for it... he was so rude I...
3162,"The exterior is a little plain but the inside and food is amazing. I will return . The food was plentiful, service was excellent and huge portions for the..."
3164,"Definitely worth the visit.  Fantastic ambiance, Great food selection, and very attentive staff.  Our server , Nicole, was very helpful in recommending..."
3164,"Had heard about Talula's Garden a while back, but kind of fell off my radar until my boyfriend heard a co-worker claim it was better than Zahav (our current..."
3164,"I'm obsessed with this place! Went here for my birthday the past few years and for an early Valentine's Day this year as well. Amazing food quality, decent..."
3165,Nurse Kyle in the ER was a god send. The other nurses still neglected to show care with their lack of information they were providing on what they were...
3165,"Great staff, very pleasant and quick upon check-in.

Physical Therapy dept/staff are wonderful, too!"
3165,Make this your hospital of last resort and then only if death is knocking at your door. I'm pretty sure most of the staff graduated from correspondence...
3171,This is a very busy hospital. If I don't call or get assistance at the front desk I will get lost. It is pretty big. But the people at the front desk are...
3171,Went here last night because I'd been having chest pain for three days. I should have went earlier given my history of cancer with chest pain being how we...
3171,"I'm from California (Sierra Nevada's) I had the best experience at the Tacoma Emergency  Room.  They were very concerned, attentive and honesty cared about..."
3175,"My husband needed to get outpatient tests done for a scheduled surgery. 
The catch is we are from out of town and in Colville due to a family emergency. We..."
3178,"The hospital took great care of my grandma, ran all kinds of blood work, chest X-rays, and more. We were in and out of the emergency room within 3 hours...."
3178,"The care of the staff have been excellent tonight, the rooms are very clean, gather the floors could be redone but what business has perfect floorings. We..."
3178,I paid a bill in may .thru my bill payer . Yet i kept getting bills. Spent hrs over coarse next month. Proving i paid it.they acknowledged .yep they...
3179,What a great community hospital.  While the ER might be slow it's so much faster than my ER visit in Portland.  I had my second colonoscopy(first was in...
3179,"If I could give no stars I would. Last year (2019), my son over injected insulin while having as severe medicine induced reaction (overdose of insulin)...."
3179,Bloodwork came back inconclusive and X-Rays were unreadable by my Orthopedist. My insurance didn't cover their billing normally and now I'm stuck with a...
3183,I was taken to this ER because the ambulance staff said that my insurance wouldn't pay if we travelled into Swedish in Issaquah.  The ER doc dismissed all...
3183,"There are so many great things about this hospital (I.e. No ER wait, nicely appointed rooms, mostly friendly staff) but not all is great. Their checkout..."
3183,If you have to go to a hospital do not go here. We had to take my father to the ER for severe back pain. He could not move or go to work and the dr jus ran...
3205,"The Notary:     At  Be toes Auto repair  Shop'                                        Just cost me  to lose my vehicle.     
  By Notarizing  A forgery..."
3205,In February of 2010 we decided to purchase a vehicle from Berto's Auto. We paid a good amount a money for what we thought was a good car. We were sold a...
3207,"Absolutely satisfied with being a customer of Mike's for many years. Always friendly, above and beyond expectations for customer service. My husband and I..."
3210,I always have a great experience at Farm Bureau Garage and I know I can trust them to do a fantastic job at a fair price. Whatever the issues are with my...
3210,"We haven't been here in years for good reason.  We used to have my mom's old Hyundai Sonata maintained here, but we were constantly bringing it back a few..."
3210,"This is hands down the best garage I've ever used. Dean and his son JD are good, decent, and pleasant-natured men and their garage does good work at a fair..."
3214,"Complete Dump. We broke down with a trailer from U haul, U haul sent out a Company to inspect the problem with the trailer. Within minuets the Tect found..."
3232,This location is actually inside the Westlake Center on the first floor in Downtown Seattle. Pretty cool store for tourists who are looking for gifts to...
3232,The salesperson was extremely rude and abrasive to me for no reason. She had an incredibly condescending tone towards me. It was off putting and made me not...
3232,This is a cute store just off of Pike Place Market in Downtown Seattle. I had the smoked fish sampler for $5 which I highly recommend. It included two...
3233,"I never give anyone five stars, but I desperately wanted to write a good review and spread out some good karma and so I am giving them five stars even WITH..."
3233,Pros: Convenient if you are in the area and would like to get some shopping done; I noticed there were certain items sold here (specifically grocery items)...
3233,Long lies at night.... Extend damn hours upstairs near pike st so we don't have fucking long lines any more I am tired of this store making me and other...
3239,"Ross is one of my favorite places to grab a good deal. But you do got to visit on a lucky day. I have purchased  multiple things from photo frame, painting,..."
3239,"Dirty!!!! A lot of things open, no inventory. Really pool layout and a lot of items missing. Skin care products is a joke. Disappointed"
3239,"I'm going on a trip fairly soon and needed some last minute, super affordable accessories and whatnot. I walk in and was immediately greeted by the theft..."
3240,"Really happy with my visit here this evening. I stopped by looking for snow boots (with snow on the way), and ended up also getting a jacket that was..."
3240,"Long story short, I will never be purchasing a Columbia jacket again... Or any other item of clothing from them.

I purchased a jacket in November 2019. It..."
3240,"If not for the slacker knuckle headed service this would have been a 4 star visit.

My hotel around the corner (Mayflower Park) presented me with a 20% off..."
3242,"So, promise you won't laugh, but I probably need to update my 5c phone since it no longer will update the Yelp app, and what's more important than the Yelp..."
3242,Terrible service! I broke my phone and came into the store with an older Samsung hoping to just swap out phones before leaving on a trip. I was told the...
3242,WOW! When Verizon phone and chat support fell down on the job Ryan and Heather stepped in and went far above and beyond to do everything in their power to...
3243,"If I could possibly give zero stars, I would. I have given it some time (more than  a month now)  while my customer experience gnawed at me. I finally..."
3243,"Stopped by this location yesterday right before closing with my friend to help her get a new phone.  Brianna, our sales associate was very informative and..."
