685,"This place sucks. The staff is rude smug and didn't care about my kid being sick.

They told me there was a 2.5 hour wait (Jeesh the waiting room is empty)..."
685,"Terrible experience today. I saw a black female provider and she was the least empathetic, uncaring medical provider I've ever encountered. She genuinely..."
687,I had been going to Dr. Brooks for several years now and have watched his practice and his attitude toward patients get worse each year his practice grew....
687,"We use to go to Dr. Brooks years ago and the practice was OK, but left because they stopped taking Tricare Standard Insurance (military insurance). I..."
687,The doctors and the staff here are really good. They've taken care of my entire family for the past few years.
693,"My annual appointment from start to finish was terrific, including a blood draw and referral for follow-up care. 

Was VERY impressed with CRNP, Sarah..."
698,Terrible and careless doctors and employees who do not care about their patients and wellbeing. They should all be ashamed of themselves here. They provide...
698,I have been going to Calvert Internal Medicine for years. They are friendly and professional. Very rarely is there more than a 10-15 minute wait. My primary...
698,I've been going to Calvert Internal Medicine for nearly 20 years. I've had Dr. Gallatin that entire time. He's a fantastic guy and always has a smile on his...
712,"Always professional, honest and upfront about whats going on. Usually very quick as well."
712,I have used their services several times and so have members of my family. It is with pleasure that I commend this business for a job always well done! My...
712,I would not recommend this place to anyone.  We took our car the to get our transmission rebuilt.  Ththey did it and gave a 1 year warranty.  The...
718,I was able to get an appointment same day for emissions and safety inspection and they were done in less than an hour. Results were sent directly to MVA to...
718,Excellent service! They are very knowledgeable and helpful. We have worked with them for several years and are always satisfied. We feel that they are...
718,Awsome service the guy at the front is always willing to help with any questions I have he's never in any attitude other then helpful. Love the service will...
719,"Team was courteous, kept me informed throughout the entire repair process, and even returned my rental car for me. I've used many other repair shops in the..."
719,"I received particularly excellent customer service from Chris.  Caliber Collision kept me updated every step of the way, and my car was ready on the same..."
719,"The folks at Caliber Collision provide the best customer service.  I took my car to them for repair after an accident back in 2017. Recently, I noticed that..."
721,"Where do I begin.... customer service is horrible and rude. They never return phone calls. Their hours of operation suck, so you better either not work at..."
721,I found a mirror years ago with a broken section. It's a really cool mirror but I wasn't sure what to do about the broken section. I thought about painting...
721,Estimate & scheduling was super easy & professional Of glass shower door. Great choice!
722,"Do you know a good mechanic? We have all been asked this question, or we have asked it ourselves.  Well I no longer have to ask, and I won't wait for for..."
722,I broke down right next to Mendenhall's Jay had me back on the road within a few hours and the price was very reasonable
722,This place is run by criminals. They took my leaf blower in for warranty work. It was run three times and ran well. The recoil mechanism for the starter was...
730,Very nice establishment. Food is delicious. Staff is very helpful and knowledgeable about what the business has to offer. Definitely will visit again!
730,received the worst haircut and experience in my life. Then the owner tried to intimidat me with his attorney because I gave him a bad review. Outright a...
730,"This place is awesomely amazing. Came here for the first time two weeks ago. Met Phil, Chef Thomas & Caitlyn. 
Ordered the burger .... so good! Can't even..."
735,Ordered vacuum for son for Christmas online and had to go out of town got a message it had to be picked up by a curtain date but you have a week from then....
735,"A large, well-stocked, and relatively clean Walmart. They have self checkout too so wait times tend not to be too long"
735,I am used to the horrible service here but today was the worst. I work with adults with mental disabilities. My client is a sweet person. We were at the...
741,"Skip the store in Prince Frederick, and go to the Verizon store in Lusby, MD for real customer service. I bought my last phone in Prince Frederick and the..."
742,I am a beach bum and have been bitten by the quilting bug. I am in the hundred dollar club at this place. What is the hundred dollar club you ask??? Well...
743,"At the risk of sounding corny, let me tell you a kernel of truth about Calvert Kettle Corn. 

Every time I've been to Calvert it's been a new and great..."
743,Popcorn is prepackaged I really wanted to get popcorn in a bucket but they only have plastic bags with twist ties.  The popcorn is good but won't last long.
743,"This place is unbelievable if you are a fan of kettle corn.  They have scores of flavors, some unique (birthday cake, pina colada), and some more usual...."
744,"4/4/30/2020 update. The store is dirty, the aisles are littered with trash and debris.  Because of the pandemic, the floors are now marked with tape so that..."
744,Came in to get some trash bags. I had to use the restroom. I asked the cashier which bathroom was in order because the sign had a white sheet of paper over...
744,This place is terrible. I live in Long Beach right next to the store and I take the time to go to prince frederick to avoid going there. The staff is...
746,"Fortunate to have this store at the mall. A very nice shopping destination. Great service, lots of parking and easy to get help.

I particularly like the..."
746,I have been going to this particular store for years due to its closer proximity to me then my favorite Nordstrom's location (Westfield Montgomery). Since I...
746,"Nordstrom.... My haven my joy.
The holy grail for shopping. Quality goods and customer service is why the company rocks! 
It's a very small store but has..."
747,"I was in town for a conference and needed a ""home away from home"" to get my sweat on. After visiting Calvert CF, I'd actually consider moving here...."
765,"Covid 19 deniers?
All just a hoax?
You want people that stupid putting their hands on you?"
765,"Barefoot Wellness is awesome. I love their monthly membership option. I took advantage and signed up for their Self Love Express option, which is a 30-min..."
765,I go to Sergina for bikini waxing and Sara for massage I love this place! Very relaxing
766,Jana was grrrrreat from start to finish with sign up and trial period! The coaches are amazing and push you to your potential and even sometimes past :-)  !...
766,Great huge space with a ton of equipment. Stopped in here to do some Open WODs and was always greeted with open arms by the coaches and staff. Chriss runs a...
766,"THE BIG: WOOO CROSSFIT!! Right off Jefferson Memorial Parkway, this Crossfit gym is perfect for any resident living in Alexandria. 

THE BLACK AND WHITE: I..."
767,This is my 1st time at this location. I've been to their other locations! The food and atmosphere here is great! Love that they play Irish music! The...
767,This was our second choice of the night due to the first choice being closed. Ordered a buffalo chicken cheesesteak and a side of fries. Son had boneless...
767,So a return trip to the hometown and decided on a late night dinner @ the Wooden Keg Tavern.  A Slow Monday evening in St.Clair but still nice to go to a...
770,I've been going to Caroline's for years. Is it fancy? Nope. Does the outside bar get rowdy? Yup. Are people trying to enjoy themselves on vacation? Yup. Is...
770,"Had a pleasant stop for a drink or two. Atmosphere was nice, right alongside a wide open bit of green marsh with no trees. Had a bunch of cranes walking in..."
770,I was hesitant to come here because I saw that a lot of yelpers did not give this place good reviews. I understand why though. It was not busy so we were...
778,Love this place!  The customer service is great and if they don't have a book they will find a way to get it
779,They make a good Irish Coffee here. Mike makes a good cheese steak and real boardwalk fries. Parking is very close but the car entrance is a block away. A...
779,"I've been here twice now and loved it both times. First was after a Yelp event nearby and the second was an Official Yelp event. How awesome it that? 
This..."
779,"Last evening at Tellus360 was a fabulous night of food, drink and socializing in a welcome newly-discovered locale that was a furniture store the last time..."
780,I highly recommend these guys!  Xplosive Entertainment DJ-ed for our wedding and were absolutely incredible.  My parents booked them and I spoke with...
780,"Amazing dj in NJ, did an amazing job for our event. Highly recommend Xplosive entertainment for all party music and dj needs."
780,"Top notch operation that Michael and Jordan run. This is the only game in town if you want to throw an off-the - hook party. DJ, MC, live rock drummer,..."
781,"This is a hidden gem of Fredericksburg. Not a lot of seating, but the pizza is indescribably good. To start off, you better be hungry when you eat here...."
781,"Have you ever been in a place, where they have a pizza so huge, that it can feed an entire village? Or maybe a place where they make their own pizza dough,..."
781,"The best pizza deal in The 'Burg. Large slice and a drink for $6. 
The place is small and sometimes it can be crowded with the line out the door but it's..."
786,"With so many breweries popping up in the area, La Cabra remains on top of my list of breweries. Not only the brews, but also the food, the atmosphere, and..."
786,"Great spot for all the right reasons.  Food, beer, staff, atmosphere and easy on-site parking.  The burgers and tacos are on point - the wings are smoked,..."
786,"This was a great find by my wife while searching nearby brewpubs on Yelp.  It's certainly nothing from the outside, but it's got a welcoming rough 'n' ready..."
789,"It is an alright park. kinda gross. Not really much of anything to see, a small playground, two soccer goals, and a bunch of grass. Lots of trash everywhere."
789,Let me start with the good~plenty of parking on a normal day but on holidays or special gatherings you will have to park down the street but no big...
789,"Probably the best all around park in Fredericksburg. Located on the rivers edge, this park features soccer fields, picnic shelters, restrooms and of course..."
794,"Opened in 1976 in time for the Bicentennial celebration of the Declaration of Independence and the birth of the nation, Liberty State Park offers about the..."
794,"At the mouth of the Hudson River, the Liberty State Park in Jersey City has fantastic waterfront views of the Manhattan skyline and the Statue of..."
794,You can take the NJ Transit light rail from Hoboken to Liberty Station for fairly cheap. There is also a ferry from Battery Park (Lower Manhattan) to Ellis...
805,Please watch my latest video for my YouTube channel Play NYCe which is devoted to the many parks and playgrounds in NYC. Teardrop Park is a unique and...
805,Great place for kids! One of the longest slides in Manhattan. Sand and rocks and giant wooden steps means hours of fun. Summer time they turn on water...
805,"Wow! What a memorial, truely a site to see! The passing thru winds makes a sounds of people cries!  it's sad saw the towers fall live!  RIP"
807,This is my 1st time at this location. I've been to their other locations! The food and atmosphere here is great! Love that they play Irish music! The...
807,This was our second choice of the night due to the first choice being closed. Ordered a buffalo chicken cheesesteak and a side of fries. Son had boneless...
807,So a return trip to the hometown and decided on a late night dinner @ the Wooden Keg Tavern.  A Slow Monday evening in St.Clair but still nice to go to a...
808,"Recently got take out from 118 North. The babaganoush was a perfect consistency; the charred bread was a spectacular accompaniment. Impressively, the Mahi..."
808,"okay. the food was not bad but was not the greatest. we got brussel sprouts (Asian sauce but salty), brisket flat bread (too small for price) and mussels..."
808,"Finally got here to see a band, Newspaper Taxis and Dead Flowers on Friday 11/13.  

Had a good night here, mostly due to the decent band and nice..."
810,I've been going to Caroline's for years. Is it fancy? Nope. Does the outside bar get rowdy? Yup. Are people trying to enjoy themselves on vacation? Yup. Is...
810,"Had a pleasant stop for a drink or two. Atmosphere was nice, right alongside a wide open bit of green marsh with no trees. Had a bunch of cranes walking in..."
810,I was hesitant to come here because I saw that a lot of yelpers did not give this place good reviews. I understand why though. It was not busy so we were...
819,"The best!!  They are really doing everything possible to offer quality, delicious food served in a safe manner. We really feel protected during this time of..."
819,"I went here for dinner while in town visiting my mother in law. I was unsure whether or not I'd like the place, despite the positive views, only because I..."
819,Disappointing. Placed a pick up order several hours in advance. Arrived to pick it up and it wasn't ready until 30 minutes after the scheduled pickup time....
820,"This place has excellent fresh Mediterranean meals with strong flavors and intelligent execution.

I ordered the Mediterranean Platter to start. It comes..."
820,"We ordered food from here tonight (during the quarantine) and had the most wonderful experience! The food was incredible (Mediterranean sampler, fish filet,..."
820,"We did takeout tonight and the food was amazing! What a delight!  So convenient. Ordered online, paid and it was delivered to our car. The Mediterranean..."
821,"I initially didn't notice this place, as it is on Caroline street and has a small tucked-away door. What a beautiful surprise when I had my first meal! The..."
821,"This place was not what I expected. My boyfriend and I walked in, expecting a large, lively restaurant, but it was SUPER small (only about 7 tables crammed..."
821,"Loved finding this little gem tucked right off the main drag, but by no means out of the way. 

Clean and earthy minimalist atmosphere, and someone running..."
822,I've eaten at Pimenta a number of times! I even took several mentees there ( aged 6-12) after a study session on Jamaica. What an awesome time we had! The...
822,"My husband and I visited Pimenta for the first time during restaurant week. We made reservations online, which I recommend doing just to be on the safe..."
822,"Our new favorite place in the burg! My family and I finally had the opportunity to visit Pimenta this evening, after visiting some family in the area --..."
825,"Excellent pizza ... excellent crust .... excellent sauce.... toppings are nice to!

Order two at a time, you'll thank me later."
825,Their buffalo chicken pizza is addicting! Really good if you like buffalo wings and pizza. Has a buffalo/blue cheese sauce and hits the spot. Just ordered...
825,"I always get delivery. It is fast and friendly. They have daily specials. 
I have ordered wings, pizza, salads, pasta and calzones. Everything is delicious!..."
826,They make a good Irish Coffee here. Mike makes a good cheese steak and real boardwalk fries. Parking is very close but the car entrance is a block away. A...
826,"I've been here twice now and loved it both times. First was after a Yelp event nearby and the second was an Official Yelp event. How awesome it that? 
This..."
826,"Last evening at Tellus360 was a fabulous night of food, drink and socializing in a welcome newly-discovered locale that was a furniture store the last time..."
831,On January 12th of 2018 I left a review regarding the food at the hospital. Mind you... my review was only a response to someone else's. It's still my...
831,"Came in today for a biopsy through Interventional Radiology. Karen the RN was incredible. She was super informative, gave me chipped ice for my anxiety..."
831,"Don't even read this just GO TO PENN. 6:15PM This place is terrible. If I was not referred here by an urgent care doc, I would have never came. Showed up to..."
834,"The facility may not be pristine, but the treatment for a mentally ill person is good. Took 2 weeks to realize that I was on wrong medicines and agree to..."
834,"Please never go here, never send your kid here, and by all means never work here. They allow staff to abuse kids and don't fire them. They don't investigate..."
834,If you are reading reviews hoping for a kind word online about this place you will not find one here and you will be hard pressed to find one anywhere. If...
836,"My grandson has had many extended stays due to an aspirating issue. The entire staff, Doctors, nurses and hospital employees, especially a gentleman Hose,..."
836,Time of the line services!  I have visited several children hospitals and this one blew me away.  They have superb customer service.  The staff truly care...
836,"The NMT has been a patient of Nemours three times so far - first, an inpatient stay for abdominal pain, then the broken arms of 2014, and now for them to..."
837,I have always dreaded going to the dentist because let's be honest dentists are not goodtimes.  it's just awful most the time and tolerable at best on other...
838,"So what had happened was, I injured my wrist; a hairline fracture . I was sent to the orthopedic center located inside Pennsylvania hospital. 

Parking:..."
838,"Another Benjamin Franklin first - the founding of the first hospital in the Original 13 - in 1751, Pennsylvania Hospital in the Society Hill section of..."
838,"I went into Penn choking and doubled over in pain. Because I had a temp of almost 102 at home, and hadn't decided to go to the ER, I took Tylenol. When I..."
839,"As I'm about to be released, my opinion and experience have improved. Staff is mostly great. All my Nurse's were wonderful. When I actually saw the doctors,..."
839,"The scariest experience of my entire life in an emergency room.
I waited almost two hours to be treated for an allergic reaction and when the IV was finally..."
839,"Please if you can hold off don't go here unless it's urgent.   they I'll charge your insurance thousands of dollars , I was there for about 5 hours and 3..."
841,"The McElderry Garage is a patient/visitor parking garage operated by Johns Hopkins Hospital. Parking is the garage is difficult to locate, until you reach..."
843,"Drive up and leave your car w their valet. And they are the friendliest parking attendants ever!!
 Walking in you are greeted by a welcoming committee of..."
843,"I love coming here no matter what the reason.  You couldn't order a better class of people to deal with. 
Since 2015, I have never had a bad day or..."
843,"Sometimes in life, you get lemons.  Stuff happens.  In our case, eight years ago the Patriarch noticed a small lump above his knee that turned out to be a..."
845,"Definitely a smaller hospital, but it gets the job done! They have done a lot of renovations on this hospital. The ER is getting upgraded to a trauma center..."
845,Absloutely the worst experience you can imagine. My daughter was admitted to the mental health area to be evaluated and sent to another inpatient facility....
845,"I observed the second visit. The doctor never approached mother and  gave her verbal discharge instructions such as following up with her physician, keeping..."
846,I do not know how anyone can give this hospital a bad review? My family and I have had numerous visits to this facility since November 2018. We did have a...
846,"If I could give their ER 0 stars I would give them NEGATIVE. 

As a patient who came in from a car accident with back, neck and head pain, I sat in the..."
846,My Sister has been a patient in the cancer ward for the last 6 months and her care by some nurses are appalling. She is not there because she wants to be...
853,I've been with Dr Weber for YEARS...near 10 I would say.  This new office staff is FAR superior to any I've had in any other office.  They trip over...
896,"Vacation in Edmonton?  Yes, my wife and daughter made me go to the West Edmonton Mall not once, but, twice during our recent vacation.  Yes, we have our..."
896,"West Edmonton Mall.. where do I begin? It's a busy mall filled with a wide variety of stores and options, however, I find it to be overwhelming when trying..."
896,WEM is my all-time favorite place to be in terms of shopping! Super convenient here in Canada because it's so damn cold all the time! I love the massive...
897,"Meh - take it or leave it.

Good for last minute snacks, gum, or a magazine before your flight or on a layover but don't expect to find any deals here.

If..."
916,This is a difficult place to disengage from. I feel they have hidden fees and it's not disclosed verbally. Not a fan. Classes are intermittent and not...
916,This place is AWFUL. It's got no good equipment and I couldn't even do my workout. All the workout suggestions online use equipment that they don't have and...
916,If you sign up and realize its not for you....take heed...make sure you send a certified letter telling them to cancel.  Pay the $4 to get a receipt.  And...
917,This is the best gym ever. The gym is really spacious and clean.  The equipment is up to date and nice.  I particularly love the classes and instructors....
917,"This gym has an unusualy large well maintained swimpool, warm water therapy pool, very large hot tub, sauna,steam room, Handicap /family Bath-changing room...."
917,"Average workout center with above average prices -nickel and diming you for towels and extra services. 
They don't offer any sort of free 1 day pass or..."
924,"2nd time attending Piranha Club.  Was my Birthday Weekend, so I wanted to try out their Prime Rib.  Very generous 14oz cut of prime rib, decided on..."
924,Great wings and good food and beer specials. Just make sure you enter through the back side of the building!
924,"Not a bad place if you find yourself in Carroll. First and foremost, walk through the correct door! If you go through the ""front"" door facing Hwy 30, that's..."
926,"I stayed at the attached hotel for 2 nights. After reading the inroom menu, my mouth was watering and i could smell the food from my room. I stayed on..."
926,"Staying here at the Carrollton. Long term.
Seems absolutely chaotic every time I've been here.
Something isn't quite working with wait staff..."
926,"This place serves peanuts & bread w/ a cinnamon butter spread.  It is attached to a hotel.  

The sandwich I had was delicious.  The burger patties were..."
927,I started a tab with a credit card. I had one dance and paid cash. The Bartender is running a scam.  He charged me for dances that did not happen. He...
931,"Fun little pool with water slides to cool off om these hot Iowa days. Admission is extremely cheap, and it has a nice concession stand as well."
954,"Fun little pool with water slides to cool off om these hot Iowa days. Admission is extremely cheap, and it has a nice concession stand as well."
960,"I stayed at the attached hotel for 2 nights. After reading the inroom menu, my mouth was watering and i could smell the food from my room. I stayed on..."
960,"Staying here at the Carrollton. Long term.
Seems absolutely chaotic every time I've been here.
Something isn't quite working with wait staff..."
960,"This place serves peanuts & bread w/ a cinnamon butter spread.  It is attached to a hotel.  

The sandwich I had was delicious.  The burger patties were..."
962,I had two flavor beef and chicken with veggies. Boy it was too sweet. I did not care for the texture of the beef. The egg drop soup was very thick. It was...
962,Order to go at 12:25. Arruve 5 min. Early expecting to wait in line to pay... 12:25 paying for food.  Only to be told well bring it out when it's ready....
962,"Service was slow. 

Food is average American Chinese. Saucy, standard dishes. Nothing spectacular. Prices are reasonable for portions. Do not expect..."
965,"Never again. Cold food, colder service. When the waitress dropped off my food she asked, ""now is there anything else?""  It was then that it occurred to me..."
965,"Ate a late lunch on Sunday September 30, 2018.

Just a typical small town diner. Lacking any sense of creativity, the menu has a limited variety of entrees..."
968,"Delicious food, but long lines everywhere. Often the pizza we were wanting was gone by the time we got to it. Probably the best fried chicken I've ever had."
968,My first time at one of these. Food was surprisingly good. Bus girls were very friendly. I only gave it 3 stars because they had a fly problem.
968,Was in town visiting my Grandmother and she really likes their chicken so we placed an order through their App. I waited the amount of time they suggested...
971,"Had three street tacos. Two carne Asada and one chicken. Asada was really sweet. Chicken was ok. I always special order, I'm super picky. It took a few..."
